source,url,date,title,content,summary,title_polarity,title_subjectivity,content_polarity,content_subjectivity,weighted_polarity,weighted_subjectivity
BBC News,https://www.bbc.com/sport/football/teams/heart-of-midlothian,2025-05-16 15:37:20.786699,Heart of Midlothian,"'McInnes move is intriguing - but don't forget Fox's impact'

Greg Playfair

Fan writer

While 'McInnes Mania' has absorbed all of Scottish football's attention over the past few days, one man that has been forgotten about is interim head coach Liam Fox.

Now, I'm not saying he should be offered the role on a permanent basis like Steven Naismith was two years ago, but he deserves more credit for picking up the pieces on a couple of occasions this season.

Fox has gone on two rescue missions; the first back in late September, to arrest the slide which saw us in 11th place in the league - above Hibs - following our worst ever league start on record.

The latest task was to take control of a side who had seen both European and Scottish Cup dreams dissolve into the ether and were nervously looking over their shoulder at a relegation play-off following five matches without a win.

The boyhood Jambo wasn't presented any opportunity to earn glory or go into the history books as one of the heroes, instead he was told to keep us out of them.

Whether Fox will be in charge for the remainder of the season remains to be seen, but he certainly can hold his head high following his latest stint that has seen us pick up two wins from two.

It's an intriguing prospect having Derek McInnes as the main man at Tynecastle, but one thing for certain is he wouldn't be wheeling and dealing on his own.

Much has been said about whether McInnes would like to work in such a set-up, but the question is: has he ever been offered the opportunity before to do so?

I know he previously turned down Sunderland and Rangers while at Aberdeen, but both those clubs had their own travails at the time and results afterwards proved that to be correct.

Given where McInnes' stock is right now, is there a bigger job than the Hearts one that will come knocking at his door? This season hasn't been his greatest at Kilmarnock, but I'm not concerned with that when it's compared to his previous experience.

I'm not old enough to remember Jim Jefferies joining Hearts from Falkirk, but I'm assured by older Jambos that this has a similar feeling to it.

I'm hoping the St Johnstone game on Wednesday takes care of itself - which would mean we potentially relegate one of McInnes' former clubs at Tynecastle - and the McInnes media circus can start to pack up when we take on Kilmarnock at Rugby Park.

I, like every other Jambo, will be glad when the final whistle blows on Sunday afternoon for the final time in the 2024-2025 season and hope that our new manager will be making plans that evening for how to bounce back in the new campaign after the summer.",'McInnes Mania' has absorbed all of Scottish football's attention over the past few days . interim head coach Liam Fox has gone on two rescue missions . the first was to arrest the slide which saw us in 11th place in the league - above Hibs .,0.0,0.0,0.10110117207055984,0.4584160114262154,0.07077082044939188,0.32089120799835075
BBC News,https://www.bbc.com/sport/football/teams/aberdeen,2025-05-16 15:37:23.378170,BBC Sport,"'Toiling Dons need to find solutions quickly'

Liam McLeod

BBC Sport Scotland Commentator

Aberdeen need an answer and quickly.

Wednesday's latest capitulation was a sobering experience for the Dons' fans as they were taken apart by effectively a second-string Celtic side on their own patch.

It was the first time they have conceded five times at Pittodrie in almost a decade when St Johnstone won by the same 5-1 scoreline that has supporters fearful of what a full-strength Celtic side could do to them in next week's Scottish Cup final.

Out of those who started for the champions in the Granite City, arguably captain Callum McGregor is the only one who will be in Brendan Rodgers' XI at Hampden.

In five games against the champions this term, Aberdeen have shipped 19 goals, including six the last time they met at the national stadium.

It is becoming more difficult to construct an argument that the odds can be upset in the wake of this one.

The latest embarrassing reverse means that fourth place is as high as Aberdeen can finish, with Hibernian's draw at St Mirren enough to secure third for the Easter Road outfit. Once 23 points clear of them, the Dons have been left behind.

It is now a straight shoot-out with Dundee United at Tannadice on Saturday for fourth place.

Concerningly for Thelin, the Dons have only taken two points away from home against top-six teams this season - the 2-2 draw at Celtic Park and the 3-3 draw at Easter Road that changed the course of both clubs' campaigns.

Thelin's Premiership record is now exactly the same as his sacked predecessor Barry Robson.

Perhaps more alarmingly, if the season had started from the date of their first league defeat at St Mirren in November they would be bottom of the table, behind relegated St Johnstone on goal difference. The spectacular start they made has spared them from what might have been.

The one positive from the wreckage of Wednesday night was that European football was secured regardless of what is to come.

But three defeats on the spin and 10 goals conceded in those matches mean Thelin has an almighty task on his hands if there is to be light at the end of the tunnel.","'Toiling Dons need to find solutions quickly', says a commentator . it was the first time they have conceded five times at Pittodrie in almost a decade . callum McGregor is the only one who will be in Brendan Rodgers' XI .",0.0,0.0,0.11951156299840514,0.5247268740031896,0.0836580940988836,0.36730881180223274
BBC News,https://www.bbc.com/sport/football/european,2025-05-16 15:37:24.509097,European Football,"Missing paperwork dashes Dutch club's European dreams

Dutch club Fortuna Sittard will not compete in Europe next season, even if they qualify, because of missing paperwork.",missing paperwork dashes Dutch club's european dreams . fortuna Sittard will not compete in european competition next season .,0.0,0.0,-0.1,0.025,-0.06999999999999999,0.017499999999999998
BBC News,https://www.bbc.com/sport/football/teams/wrexham,2025-05-16 15:37:27.254002,BBC Sport,"'If you go to the moon, there'd be someone asking, how are Wrexham doing?'

Image source, Getty Images

Mickey Thomas says he has never seen football club owners boasting a better relationship with fans than Wrexham's Hollywood duo Ryan Reynolds and Rob McElhenney.

Wrexham will play in English football's second tier next season for the first time in 43 years after clinching second spot in League One last weekend.

The Dragons have become the first club in the history of England's top five divisions to secure three straight promotions.

Their spectacular run has come following the takeover of the club by Reynolds and McElhenney in 2021, when they were a non-league side.

""What they have done is unique - it's incredible,"" Wrexham legend Thomas told this week's Feast of Football podcast.

""The transformation from the National League to where they are now is massive and they have done it in the right way.

""I have never seen owners of a football club have the association they have with the players but more so with the fans. The connection is unreal.""

Former Manchester United player Thomas, 70, made his name at Wrexham in the 1970s before returning to the club at the back-end of his career, when he famously scored a spectacular free-kick in a shock FA Cup victory over Arsenal.

Image source, Getty Images

The ex-Wales international (above) had not met Reynolds and McElhenney until last Saturday's promotion-clinching win over Charlton, when he was invited to the owners' box and then asked to celebrate on the pitch alongside them afterwards.

""I don't think anyone can really believe what's happened to the football club,"" Thomas added.

""Everyone wants to go and watch Wrexham. You can't get a ticket these days.

""It's not just Wrexham, it's globally. They have captured the whole universe haven't they? I am sure if you go to the moon, there'd be someone there asking 'how are Wrexham doing?'.

""I didn't see this happening. But what they have done is they have got the right man in charge in Phil Parkinson and the recruitment has been second to none.""

As Wrexham prepare to compete with some heavyweight clubs in the Championship next season, Thomas says another promotion is not inconceivable.

""We know they will do well to finish halfway in the Championship or whatever, but you wouldn't put it past them, that they could get automatic promotion next year,"" he said.

""You might laugh at that, but you never know with these two guys, everything they touch turns to gold.""",Wrexham will play in english football's second tier next season for the first time in 43 years . the dragons have become the first club in the history of England's top five divisions to secure three straight promotions . their spectacular run follows the takeover of the club by Reynolds and McElhenney in 2021 .,0.0,0.0,0.2249007936507937,0.3502865961199294,0.1574305555555556,0.24520061728395057
BBC News,https://www.bbc.com/sport/football/articles/c771rzln6yno#comments,2025-05-16 15:37:29.387113,Steven Fletcher: Striker to leave Wrexham 'not by choice',"Fletcher had been considering retiring when Wrexham's approach prompted his arrival at the Stok Cae Ras on a free in September 2023.

A former Premier League frontman for Burnley, Wolves and Sunderland, Fletcher proved his worth as Wrexham won promotion from League Two, earning a one-year contract-extension last summer.

Fletcher admitted in March he had expected to have returned to retirement, adding that he didn't see ""why he would want to stop"" given his ongoing impact.

He played a super-sub role as Wrexham returned to the second-tier for the first time in 42 years, with all bar two of his 43 appearances coming off the bench as he again scored eight league goals.

In his exit announcement, Fletcher added: ""I will be forever grateful for the opportunity to come here and fall back in love with the game!

""To have had the experiences and the opportunities that this club has given me has been just incredible. And this group of lads are the best that I have ever shared a changing room with.

""It's not just a team or a changing room. This group of boys , fans and staff have been my family for the past two years.

""You welcomed me with open arms and open hearts and made me feel like I had a purpose again.""

Fletcher's announcement came after goalkeeper Mark Howard – who had figured in all three of Wrexham's successive promotions – also revealed he would not be staying beyond the end of his current deal.

Wrexham co-owner Rob McElhenney said on social media that such exits were ""the worst part"", adding: ""they are not just players on the team. They are my friends and people I admire"".

In response Wrexham director Humphrey Ker posted he was ""slightly in awe"" of Fletcher ""when he arrived at Wrexham, on account of his extraordinary career at the very top of the game"".

Ker added: ""Now, after two glorious years in his company, I'm even more in awe of him, on account of his abilities, his leadership and friendship. Man who's given me moments of joy that'll last a lifetime.""","former premier league frontman reveals he had expected to retire . he played a super-sub role as Wrexham returned to the second-tier for the first time in 42 years . former burnley, Wolves and sunderland frontman admits he didn't see ""why he would want to stop""",0.0,0.0,0.13,0.40399999999999997,0.091,0.28279999999999994
BBC News,https://www.bbc.com/sport/football/articles/cv2gd3jr387o,2025-05-16 15:37:31.717247,Tottenham's John White and his son's search for lost superstar,"North London is humid and Rob White is tired.

""We had ridiculous storms here last night,"" he says.

""I woke up at 4am and it was like someone switching a neon light on and off in my room.

""Even at the age of 60, that takes me somewhere.""

White is aware of the cliche.

""The clap of thunder, the flash of lightning, it is almost lazy as a plot device isn't it?"" he says.

""You see it in movies, in books, in plays - it goes all the way back to Greek tragedy.""

But for his story, it is undeniable and unavoidable. Every bolt lands in the same place: 21 July 1964.

Sixty years ago, a summer storm erupted over Middlesex and lightning struck a lone golfer.

John White, 27, was found crouched and scorched under a tree, the rings on his fingers fused to the shaft of the club he was clutching.

Tottenham and Scotland had lost one of the finest footballers of his generation - a Double winner, with a European Cup Winners' Cup medal to his name - at the height of his powers.

Rob, just six months old at the time, had lost a father.

His search has continued ever since.","a summer storm erupted over Middlesex in 1964 and lightning struck a lone golfer . he was found crouched and scorched under a tree, the rings on his fingers fused to the shaft of the club . his story is undeniable and unavoidable .",0.0,0.0,-0.015555555555555557,0.2694444444444445,-0.010888888888888889,0.18861111111111112
BBC News,https://www.bbc.com/sport/football/live/c39jgy3yenmt,2025-05-16 15:37:34.690837,Bayern Munich 2-0 Borussia Monchengladbach: Harry Kane scores as Bundesliga champions win,"Harry Kane scored and then lifted his first ever trophy as newly crowned Bundesliga champions Bayern Munich beat Borussia Monchengladbach in Thomas Muller's last home game for the club.

With 31 minutes played, Michael Olise cut inside before aiming a shot towards the top corner that was headed in by Kane for his 25th Bundesliga goal of the season.

Kane was restored to the starting line-up after serving a one-match suspension and proved his worth as he has done consistently throughout the campaign that saw Bayern reclaim the title.

Kane was soaked with beer in the post-match celebrations and trophy lift, celebrating on the pitch with his wife, children and parents.

""It's been a long time coming,"" Kane said. ""It means more than any of the goalscoring awards, for sure.

""There's no secret that there has been this one thing that has been missing from my resume.

""It was a weight on my shoulders and now it's been lifted. I've had plenty of individual accolades and been close on so many occasions to trophies, but for one reason or another, it hasn't quite worked.""","Harry Kane lifts his first ever trophy as newly crowned champions Bayern Munich beat borussia monchengladbach . he was restored to the starting line-up after serving a one-match suspension . his wife, children and parents celebrated on the pitch with their children .",0.8,0.4,0.16575757575757574,0.3762289562289562,0.35603030303030303,0.3833602693602693
BBC News,https://www.bbc.com/sport/football/articles/cwy7w5dd37jo,2025-05-16 15:37:36.719121,Gianni Infantino: Uefa accuses Fifa president over 'private political interests' and stages congress walk-out,"Uefa accused Gianni Infantino of prioritising ""private political interests"" after Fifa's president turned up late for the world governing body's own congress in Paraguay.

Infantino has been on a diplomatic tour of the Middle East alongside United States President Donald Trump and arrived two hours and 17 minutes past the scheduled 10:30 start time (14:30 BST) for the Fifa event.

Infantino said his trip prior to the congress had been crucial as it allowed him ""to represent football"" in ""important discussions"" with ""world leaders in politics and economy"".

In protest at the 55-year-old Swiss-Italian's delayed arrival, Uefa president Aleksander Ceferin led a group of European delegates, joined by Football Association chair Debbie Hewitt, in staging a walk-out during a break at the event.

It meant there were clearly empty seats at the Conmebol Convention Center in Luque, on the outskirts of the Paraguayan capital of Asuncion, when the meeting resumed.

Uefa said in a statement the ""last-minute changes"" to the timings were ""deeply regrettable"" but ""a point"" had to be made.

""The Fifa congress is one of the most important meetings in world football, where all the 211 nations in the world's game gather to discuss issues that affect the sport right across the world,"" said European football's governing body.

""To have the timetable changed at the last minute for what appears to be simply to accommodate private political interests, does the game no service and appears to put its interests second.

""We are all in post to serve football, from the streets to the podium, and Uefa members of the Fifa council felt the need on this occasion to make a point that the game comes first and to leave as originally scheduled.""","uefa accuses infantino of prioritising ""private political interests"" the 55-year-old has been on a diplomatic tour of the Middle East . he arrived two hours and 17 minutes past the scheduled 10:30 start time .",0.0,0.2375,0.031878306878306874,0.39047619047619053,0.02231481481481481,0.34458333333333335
BBC News,https://www.bbc.com/sport/football/articles/cd624g409p2o,2025-05-16 15:37:39.570683,Jeremie Frimpong: Liverpool ready to trigger Bayer Leverkusen star's release clause,"Liverpool are ready to trigger the release clause of Bayer Leverkusen's Jeremie Frimpong as they close in on their first summer signing.

The 24-year-old, who can play across the right-hand side, is wanted by fellow Dutchman Arne Slot for next season's campaign and talks towards a deal have progressed in recent days.

Frimpong's release clause is understood to be in the region of 35m euros (£29.5m), with Liverpool expected to meet that figure.

If the Premier League champions can complete a swoop for the Netherlands international, it could help soften the blow of losing Trent Alexander-Arnold, who is set to join Real Madrid after confirming his decision to leave Anfield when his contract expires at the end of the season.

Frimpong, who came through the youth ranks at Manchester City and played for Celtic, could replace the 26-year-old Alexander-Arnold at right-back.

He has made 53 appearances in all competitions for club and country this season and played an integral role in helping Leverkusen to their first Bundesliga title in 2024.

Frimpong's former club Celtic would be due a portion of any transfer fee Leverkusen receive, with some reports suggesting the sell-on fee negotiated when he left the club in 2021 could be as high as 30%.","jeremie Frimpong's release clause is understood to be in the region of 35m euros (£29.5m) the 24-year-old is wanted by fellow Dutchman arne Slot for next season's campaign . if the premier league champions can complete a swoop for the defender, it could help soften the blow of losing Trent Alexander-Arnold .",0.2,0.5,0.07192307692307692,0.263974358974359,0.11034615384615384,0.3347820512820513
BBC News,https://www.bbc.com/sport/football/womens/scottish,2025-05-16 15:37:41.799863,Scottish Women's Football,"McGovern 'a good fit' for Scotland - Andreatta

Amy Canavan

BBC Sport Scotland at Hampden

Image source, SNS Image caption, McGovern has scored 25 goals for Hibs this season

Scotland head coach Melissa Andreatta believes Kathleen McGovern is ""what Scotland need"" after the Australian called up the Hibernian striker to the national team for the first time.

McGovern has 25 goals for the SWPL league leaders this season and has represented Scotland at various youth levels.

At her first news conference as Scotland boss, the Australian said she had taken in Hibs' Edinburgh derby win at Hearts and the forward caught her eye.

""It's a combination of that [what I saw in that game] and just what I would like to do with this team,"" Andreatta said.

Despite being just 22 years old, McGovern has been on the domestic scene for some time and excelled at city rivals Hearts before joining Hibs in the summer.

After coming through the ranks at Celtic, she spent a season in Germany with SC Sand and built on her fierce finishing and superb strength.

""I think her personality also, what you see on the field and she's a good fit for this team and what we need in this point in time,"" Andreatta added.

""She's worked really hard for this opportunity and she's deserved it with those performances week in, week out and earned it.""","'it's a combination of that [what I saw in that game] and just what I would like to do with this team,' she said . the 23-year-old has scored 25 goals for the SWPL league leaders this season .",0.0,0.0,0.23802083333333338,0.3692708333333334,0.16661458333333334,0.25848958333333333
BBC News,https://www.bbc.com/sport/football/europa-league,2025-05-16 15:37:43.743437,Europa League,"Will Man Utd or Spurs save their season and who needs it more? Video, 00:02:54Will Man Utd or Spurs save their season and who needs it more?","will man Utd or Spurs save their season and who needs it more? video, 00:02:54Will man Uthd or swansea save season?",0.0,0.0,0.5,0.5,0.35,0.35
BBC News,https://www.bbc.com/sport/football/articles/crljk2kg058o#comments,2025-05-16 15:37:45.767249,Cristiano Ronaldo: Portugal forward tops Forbes highest-paid athlete list in 2025,"Cristiano Ronaldo has topped the Forbes list of highest-paid athletes for the third consecutive year, while NBA star Stephen Curry has moved up to second.

The business magazine, external says Ronaldo, who has topped the list fives times during his career, has increased his estimated total earnings by $15m to $275m (approx £206m).

That figure has only been surpassed by former world champion boxer Floyd Mayweather, who earned $300m in 2015 (then £194m) and $275m in 2018 (then £205m).

Portugal forward Ronaldo, 40, moved to the lucrative Saudi Pro League with Al Nassr in December 2022 and has generated greater income through off-field endorsements and sponsorship deals backed by his social media followers, which currently total 939m.

Golden State Warriors guard Curry, who became the first NBA player to reach 4,000 career three-pointers in March, climbs up to second after earning $156m (approx £117m).

British boxer Tyson Fury moved up to third with $146m (approx £109m) despite losing his world heavyweight titles to Ukraine's Oleksandr Usyk in December.

Fury was the beneficiary of a Netflix reality television show and a partnership with Maltese tourism.

Ronaldo's long-standing rival Lionel Messi has fallen further behind the Portuguese after dropping from third to fifth.",Cristiano Ronaldo has topped the Forbes list of highest-paid athletes for the third consecutive year . the 40-year-old has increased his estimated total earnings by $15m to $275m (approx £206m) that figure has only been surpassed by former world champion boxer Floyd Mayweather .,0.0,0.0,0.040196078431372545,0.3058823529411765,0.02813725490196078,0.21411764705882352
BBC News,https://www.bbc.com/sport/football/articles/c249nmyv6mjo,2025-05-16 15:37:48.061213,Dejan Kulusevski: Tottenham midfielder out for a 'few months' - Ange Postecoglou,"Tottenham midfielder Dejan Kulusevski is facing ""at least a few months"" out with a knee injury, head coach Ange Postecoglou says.

Kulusevski became the latest Tottenham player to be ruled out of next Wednesday's Europa League final against Manchester United after having an operation on his right knee.

The Sweden international, 25, had been forced off in the 19th minute of Spurs' 2-0 defeat by Crystal Palace on Sunday.

""Yeah, gutted for Deki,"" said Postecoglou before his side's trip to Aston Villa on Friday.

""Disappointing news. Initially we thought it wasn't too serious. The medical team were worried structurally about how the knee was but it blew up the day after and we knew there was an issue there.

""He has had surgery and it will put him out for at least a few months.

""I have only got basic information at the moment in terms of recovery, but it will certainly put him out for a while.""

Kulusevski, who has scored 10 goals and added 11 assists from 50 appearances in all competitions this season, joins fellow midfielders James Maddison (knee) and Lucas Bergvall (ankle) on Spurs' injury list for the Europa League final in Bilbao.","dejan Kulusevski is facing ""at least a few months"" out with a knee injury, head coach says . the 25-year-old had an operation on his right knee in the 19th minute of 2-0 defeat by crystal palace . he became the latest player to be ruled out of next Wednesday's Europa League final .",-0.2,0.1,-0.06851851851851852,0.4277116402116402,-0.10796296296296296,0.32939814814814816
