source,url,date,title,content,summary,title_polarity,title_subjectivity,content_polarity,content_subjectivity,weighted_polarity,weighted_subjectivity
BBC News,https://www.bbc.com/sport/football/live/c5yxwq9zx2gt,2025-05-16 15:37:50.016027,"Leicester City vs Ipswich Town: Premier League preview, team news, stats & head-to-head","Leicester are unbeaten in their last 10 home league games against Ipswich (W5 D5) since a 2-1 loss in the second tier in December 2002.

The away side has never won in seven previous Premier League meetings between Leicester and Ipswich (D2 L5), with Ipswich losing two of their three visits to the Foxes.

Both Leicester and Ipswich have already been relegated from the Premier League this season. It’s the third time they’ve gone down in the same campaign (also 1994-95 and 2001-02), the most of any pair of teams in the competition’s history.

Leicester have lost their final home league game in three of the last five seasons (W2), though have won their last two such matches as a Premier League side (4-1 v Southampton in 2021-22, 2-1 v West Ham 2022-23).

Ipswich won their final away league game of 2023-24 (2-1 v Coventry), but haven’t done so in consecutive campaigns since a run of three between 1995-96 and 1997-98.

Leicester’s 2-0 win against Southampton in their last home match ended a nine-game losing run at the King Power Stadium in the Premier League. They last won consecutive home top-flight matches in May 2022.

Leicester have won 2-0 against Southampton and drawn 2-2 with Nottingham Forest in their last two Premier League games, netting as many goals as they had in their previous 14 in the competition beforehand (4).

68% of Ipswich’s points in the Premier League this season have come away from home (15/22). As it stands, it’s the highest share of points a team has won on the road in a single campaign in top-flight history.

No side has scored fewer second half goals than Ipswich (13) in the Premier League this season, with the Tractor Boys netting the lowest share of their goals after half time (37%). Meanwhile, only Southampton (43) have conceded more second half goals than Ipswich in the competition this term (39).",away side have lost their last 10 home league games against Ipswich (W5 D5) since a 2-1 loss in the second tier in December 2002 . both have been relegated from the premier league this season .,0.0,0.0,0.015702947845804997,0.2879109977324263,0.010992063492063497,0.2015376984126984
BBC News,https://www.bbc.com/sport/football/articles/cyvm76rl5jgo,2025-05-16 15:37:51.940853,Hearts: Derek McInnes 'not in charge' of Kilmarnock against Tynecastle side,"Archie: What an embarrassing last few days for our club. I'm genuinely disgusted. For 60 years I've followed Kilmarnock and I have never seen such despicable behaviour.

Derek McInnes talks of how he always puts Killie first? Don't make me laugh. I'll be glad to see the back of him. Where was he post-match?

Billy Bowie should come out and explain the situation because it's a complete and utter shambles.

Alastair: McInnes was the man at the right time for us, but it certainly is his time at Kilmarnock to finish. No point in us berating him; instead we should be looking forward to a new manager with new ideas to put us back up where we should be.

Scott: The game was a complete sideshow to the mess McInnes has created over the last week.

If he wanted to see out the season, he needed to say he's the Killie manager and completely focused on finishing the season strongly with us. Nothing about Hearts until the season is over.

But instead, he's created a circus. Paul Sheerin's post-match comments were embarrassing and patronising to the fans, too.

James: I think Hearts and, to a certain extent, the media have treated Kilmarnock with total disrespect. They could easily have waited until next week to make their approach for McInnes.

Killie are certainly in a better position than when McInnes arrived, and I just hope the next manager can take us forward.

Graeme: Derek has punched above his weight at Killie. Unfortunately, we have to accept that Hearts are a bigger club - not a better club - than we are and he deserves the chance to go there and progress both Hearts and himself.

Future Scotland or Premiership manager, maybe? Good luck to him, but glad he won't be in the away dugout on Sunday.",Derek McInnes says he always puts Killie first? don't make me laugh. I'll be glad to see the back of him . it's a complete sideshow to the mess he has created over the last week . he's created a circus .,0.0,0.0,0.06996116628469569,0.4462057550292844,0.04897281639928698,0.31234402852049903
BBC News,https://www.bbc.com/sport/football/articles/c0mr1981vvmo,2025-05-16 15:37:53.491858,Everton plan to reduce Goodison Park capacity before women's team move in,"Everton are drawing up plans about how they will reduce the capacity of Goodison Park when the club's women's team move in, including closing some of the stadium's upper tiers.

The 133-year-old stadium plays host to its final Premier League game on Sunday, when Everton face Southampton, before moving to a new 53,000-capacity arena at Bramley-Moore Dock.

Everton have announced that proposals to demolish Goodison Park have been scrapped and will be used for their women's team from next season.

The women's team average attendance has been 2,062 at their current home at Walton Hall Park and Everton are keen to make Goodison more intimate with its current capacity at 39,572.

The club will now reconfigure Goodison Park, with the Main Stand's top balcony, the Upper Bullens Road Stand and the upper tier of the Howard Kendall Gwladys Street End not in use, but instead covered in Everton's women's team branding.","goodison park will be used for their women's team from next season . the 133-year-old stadium plays host to its final premier league game on sunday before moving to a new 53,000-capacity arena .",0.0,0.0,0.06807359307359308,0.35627705627705625,0.04765151515151515,0.24939393939393936
BBC News,https://www.bbc.com/sport/football/teams/manchester-city,2025-05-16 15:37:56.176777,"Transfer news, results, fixtures, video and audio","Mubama ready to take next step

Simon Stone

Chief football news reporter

Image source, Getty Images

Manchester City striker Divin Mubama will not be part of the club's Premier League 2 squad next season but it is not clear whether he will be sent out on loan or granted a permanent move.

The jewel in West Ham's FA Youth Cup-winning team in 2023, 20-year-old Mubama joined City the following year after his contract expired at the London Stadium.

Mubama made two senior appearances for City this season - adding to his 18 under David Moyes at West Ham - and scored against League Two Salford in the FA Cup third round in January.

However, he has spent most of the campaign in PL2 and took his tally in the end of season play-offs to five with two second half efforts in Friday's semi-final win over Manchester United.

City's Elite Development Squad head coach Ben Wilkinson knows Mubama will not be around next term. But he is also aware the next steps for any young striker are hazardous.

""We've got players in our team we'd expect not to see next year because they're ready to make that step and he's probably one of them,"" said Wilkinson.

""It's trying to help with that next step and guide them in the right direction.

""We've had it the last three, four, five years with some real high potential players from the 18s and 21s and now they're playing on our TV screens every other week.

""The problem is it has been notoriously hard for young strikers to go out on loan and succeed in the Championship or League One. You used to have someone next to you and now you're a 19, 20-year-old number nine up against two big centre halves and the service might not be great.""

Wilkinson cites the example of Liam Delap, who had patchy loan spells at Stoke and Preston around the same age Mubama is now, before going to Hull last season, where he scored eight times in 32 appearances.

That persuaded Ipswich to take a chance by signing him permanently in a £20m deal last August, since when Delap has gone on to become one of the most coveted young strikers in the Premier League.

Wilkinson added: ""Liam was outstanding at this level, then had two or three loans and his numbers weren't outstanding.

""Now he has grown into his body and has been outstanding in the Premier League this year.

""Often the first move isn't as successful as you'd like it to be but that is a good thing because here they live in this bubble of academy football where we are successful and have a lot of the ball - Divin tonight had four good chances to score but will he get that in a Championship game? It's a tough one.""",the 20-year-old striker will not be part of the club's premier league 2 squad next season . it is not clear whether he will be sent out on loan or granted a permanent move . he made two senior appearances for city this season - adding to his 18 under David Moyes .,0.0,0.0,0.1682577326055587,0.3941097308488612,0.11778041282389108,0.2758768115942028
The Guardian,https://www.theguardian.com/us-news/2025/may/15/south-african-refugee-antisemitic-posts,2025-05-15 00:00:00.000000,White Afrikaner brought to US by Trump administration has history of antisemitic posts,"One of the white Afrikaners brought into the US as refugees by the Trump administration this week has a history of antisemitic social media posts, despite the White House using alleged antisemitism as a rationale for deporting pro-Palestinian protesters.

Charl Kleinhaus posted on X in 2023 that “Jews are untrustworthy and a dangerous group.” In another post last fall, he shared a rightwing, nationalist YouTube video that was later removed, titled: “‘We’ll shoot ILLEGAL Immigrants!’ – Poland’s Illegal Islamic immigrant solution,” with clapping emojis.

A number of Kleinhaus’s posts also promote the conspiracy theory that white people in South Africa are being particularly persecuted.

Kleinhaus confirmed to several media outlets, including the Bulwark and New York Times that he was the owner of the account that contained antisemitic and racist posts, though he insisted to the Times that he was not antisemitic and claimed to have written a post in error while on medication.

The Trump administration has engaged in a systematic campaign to arrest and attempt to deport pro-Palestinian activists in recent months, claiming that they are engaging in antisemitism. The Department of Homeland Security (DHS) said last month it will begin screening immigrants’ social media activity for antisemitism, using it “as grounds for denying immigration benefit requests”.

Kleinhaus, however, was recently granted refugee status by the US government, along with 58 other white South Africans, and landed this week at Washington Dulles international airport.

“We just packed our bags and left” for “safety reasons”, Kleinhaus, who according to his LinkedIn profile owns a mining company in South Africa, told the New York Times on arrival.

Afrikaners are a white ethnic minority that ruled South Africa during apartheid, implementing harsh policies of racial segregation in the country until the regime was officially abolished in 1994.

Some white supremacist Afrikaners – as well as Donald Trump and his biggest financial backer, Elon Musk, who was born and raised in South Africa – have promoted the false conspiracy theory that there is a “white genocide” taking place in the country.

In February, Trump signed an executive order saying that Afrikaners were unjustly being persecuted with little intervention from the South African government, and granted a group of them refugee status.

A senior DHS official said in a statement: “The Department of Homeland Security vets all refugee applicants. Any claims of misconduct are thoroughly investigated, and appropriate action will be taken as necessary. DHS does not comment on individual application status.”

Kleinhaus did not immediately respond to questions.

This week, the Episcopal church said it would be ending its refugee resettlement program with the US government, pointing to the Trump administration’s approach to resettle the white Afrikaners.

“It has been painful to watch one group of refugees, selected in a highly unusual manner, receive preferential treatment over many others who have been waiting in refugee camps or dangerous conditions for years,” said the presiding bishop of the church, the Rev Sean W Rowe.

",the white house used alleged antisemitism as a rationale for deporting pro-Palestinian protesters . a number of Kleinhaus’s posts promote the conspiracy theory that white people in South Africa are being particularly persecuted .,0.0,0.0,-0.035272366522366524,0.3139069264069264,-0.024690656565656565,0.21973484848484848
